,Name,Rating,Date,Review
86,Caffé Vittoria,4 star rating,1/22/2020,"BC I'm basic and follow Thrillist like the bible, I succumbed to their recommendation to visit Cafe Vittoria. They describe the front door as almost a teleport, transporting visitors to a cafe in Italy itself. Well, I like to travel. I hope customs isn't strict bc my passport is currently in the possession of the USPS for renewal. 

There is a slight culture shock inside the place. The decor is unusual and quirky. We took a seat at one of their little cafe tables near a nook which has a mural of some Italian scene on it. I didn't inspect it because I was facing the other way and there were tables against the wall so that felt awkward to me. 

The menu has a ton of cafe beverages, as you probably expected. I, again being basic, ordered a cappuccino. The gelato case near the entrance put the idea of ice cream in my head and I conveniently remembered that it's been AGES since I've had sorbet. We went with mango. Finally, my GF brought their pastries to my attention. Lobster tail caught my attention. What the fuck is that doing on a pastry menu? I then received an education and for the sake of completion, had to try it of course. 

The waitresses were a bit bitchy, NGL. I took one for the team and ordered everything so my little lobster tail only ordered a glass of water which classically never came. 

The cappuccino was incredible. One of the best I've had in a long time. It was incredibly creamy and rich with a hint of chocolate (unless I'm hallucinating). The sorbet was very sweet but smooth and DELICIOUS. The lobster tail crust was flaky and crunchy. The cream inside was thick without being too heavy with a touch of sweetness. I couldn't decide whether I wanted to eat the dough or the cream more. I kept becoming overwhelmed with the richness of the pastry and halting my consumption but I kept coming back for more. It was actually so intense that I had planned all week to go to Magnolia later for one of their infamous banana puddings but literally had zero desire for any further dessert for the rest of the day. 

This is a GEM. Every trip to Boston requires a visit to this place and the espresso beverages are a must."
87,Caffé Vittoria,5 star rating,5/27/2019,"Boy do I wish this place existed for me back home. I absolutely LOVED the ambiance and setting of this cozy cafe. The space is small, intimate, and bustling with happy diners enjoying amazing pastries and coffees. You must try the cannoli - it is to die for. Best I've ever had! 

The spot is cash only, so be prepared!"
88,Caffé Vittoria,1 star rating,12/28/2019,"So I came here to just a slice of teramisu to go. First off, the customer service was a little rude. We were standing by the bar to order, and no one was paying attention to take our order. When a waitress finally asked what we wanted, she told one of the kids behind the bar to give it to us and take our payment. This kid wasn't even paying attention with his iPod buds in his ear. I waved him down at the counter and asked him what the cost was. 

He gave me the wrong change so I asked him what the cost was again showing the change, and he just stared as if I was crazy. After going back and forth multiple times, I ended up just letting it go. 

The teramisu wasn't very impressive either. Never coming back here again.

Don't think it's worth coming here."
89,Caffé Vittoria,5 star rating,7/3/2021,This place is as Italian as it gets! Authentic cappuccinos/lattes and pastries. Nice touch with adding cocoa powder to the top of the cappuccino. Fantastic.
0,Cantina Italiana,4 star rating,11/24/2021,"Really good spot on Hanover street. 
This wasn't the first place I wanted to try when I moved to the neighborhood. I think this was because the sign kinda looks like a Mexican place and then it's Italian so my brain was a little confused. 
Well... it was delicious. My bolognese was so good and we got a nice bottle of red to split as well. Our waitress was so nice and the place is adorable on the inside. 
Awesome spot for a low key Italian dinner in the north end!"
1,Cantina Italiana,3 star rating,2/27/2022,"Tried Cantina Italiana for dinner a few weeks ago and was excited by the reviews! The service was decent, just wanted to give a shout out to the waiters that refilled our waters, they were really on top of it and I don't think my cup ever went empty. 

We got the Nutella martini, the bolognese and the salmon pasta dish. For the Nutella martini it was interesting but I feel like the alcohol in it was a bit overwhelming and the cocktail was a bit messy in that it was dripping on the side of the cup and my hands got really sticky. 

As for the pasta dishes the salmon was well cooked and the pasta noodles were also well cooked. However the sauces were very subpar, the bolognese didn't really have that meaty flavor that I was hoping for.

Overall the experience was decent but I'm not sure that the food taste and quality measured up to the price we paid."
2,Cantina Italiana,3 star rating,2/4/2022,"I wasn't blown away by this place but it's nice in the inside, has a nice bar area and my food was good enough to be a 4. My issue was the service was terrible. I'll admit I was in for an early dinner, like 4PM, and they all seemed distracted by setting up for the dinner rush than paying any attention to the couple early customers they had already, including me. Not sure the issue but every step was slow, getting me a menu, getting me a drink, ordering, my food coming out, refilling my drink and getting my check when I was done. Everything was slow it was like I was invisible. At one point I just wanted another drink and I literally couldn't even get the bartender to glance at me for 10 minutes. 

The food, albeit a long wait, was solid. Nothing spectacular and plenty better in the North End but good. I especially liked the pasta fagioli soup I got before my meal. Again, had I gotten a little attention in the service I probably would give it a 4. Maybe just an off night as far as that goes? Unsure."
3,Cantina Italiana,3 star rating,11/16/2021,"Scored a 6pm reservation for 4 for a celebratory dinner. When we arrived we were quickly seated at a small booth. Luckily we were able to move to a slightly more spacious table towards the back, though be prepared to be in close quarters with other parties. They really want it to feel like you're eating at grandma'a house here, so try to get comfortable. 

We started with a few spritz cocktails and the calamari and the prosciutto mozzarella appetizers. The drinks were tasty and not too strong. The calamari was a verrry small portion for the cost, but pretty tasty. The prosciutto and mozzarella was pretty basic. Just exactly as described. The waiter was frequently asking if we were ready to order entrees, so we appeased him and did.

For mains, we all ended up with bombolotti dishes. Mine included the lobster tail, shrimp and tomato sauce. Pretty tasty, though not very spicy as he warned. The shells were on both the shrimp and lobster. The pasta shape is a fun treat, but overall the portions weren't big enough to satisfying the hungry men in my party. 

Overall not a very classy celebration I hoped for, felt rushed by the waiter, but was fun to try a historic pasta dish in the North End."
4,Cantina Italiana,5 star rating,9/23/2021,"We popped in here for a drink and an appetizer. 
If you're looking for an amazing bruschetta and a refreshing cocktail, this is the spot. 

I loved their outside dining, but we sat in the bar for a cool down. 

I'm so glad we picked this spot."
5,Cantina Italiana,5 star rating,12/13/2021,"This was a great place to go on a Saturday night for some great italian food. I loved this place! The service was great and the pasta was very authentic. I also got an espresso martini and that was perfect. You have to make a reservation or else you are not going to get a seat. I made one about two weeks prior so I definitely recommend getting in your reservation ASAP!
Ambiance is great and it was fun to be in the North End."
6,Cantina Italiana,5 star rating,6/4/2021,"We specifically chose this restaurant due to its long standing history in the North End and are happy we did.  We landed here 2/3rds into our Freedom Trail walk.  It was early afternoon on a weekday so not too busy and we were probably all tourists!  We were seated immediately and brought water (score).  It is hard to explain, but bringing me water right away always sets a positive tone to my dining experience... might also have been that we had been walking for a couple hours and I was thirsty!

We ordered some Calamari, a Caesar salad and a couple of dishes -- the Cioppino and Gnocchi al Forno (with shrimp).  SO delicious... ALL of it.  I absolutely loved the Caesar Salad -- when done right and with homemade dressing that is not too heavy it is perfection and they nailed it.  We had the Tiramisu for dessert and that too was fantastic."
7,Cantina Italiana,5 star rating,11/8/2021,"Fantastic  food wine and service in a building that hasn't been remodeled in decades. Remember your here for the food, not the ambiance - everything came out fresh and delicious! Our server Omar was a pro and handled everything with ease!"
8,Cantina Italiana,3 star rating,3/5/2021,"Food was average or slightly above among north end restaurants.  We added $7 or so for half portion of the truffle gnocchi, which turned out to be the best (both taste and value). 

What was concerning was the practice during the pandemic.  MA and Boston requires 25% maximum capacity and 90min limited dining time. Cantina is for sure not enforcing either."
9,Cantina Italiana,5 star rating,1/31/2021,"Dined here last night. Fatima helped us--she's very nice and provide great recommendations.

Cantina Italians is advertised to be the oldest restaurant in the North End--we'll take it. Worth trying considering the ease of reservation and decent reviews on Yelp, as well as on other platforms. 

Food was delicious. See pictures. 

As for pandemic handling (12/30/2021) - One concern we have is whether the restaurant actually comply with the 25% max capacity. We were one of the first guests, but when we were done, almost every table was occupied. It did not look like 25% max capacity to us. They might've overbooked or did not turn newer customers away when arrived.  Place was, I must say, really crowded. Menu should be switched to 1-time used paper menu rather than reusable plastic menus. Plus side, there's hand sanitizer on every table."
10,Cantina Italiana,5 star rating,2/5/2022,"Good authentic Italian North End spot! Great food, reasonable prices and out standing service"
11,Cantina Italiana,4 star rating,11/1/2020,"After living out of state for the last two years I was really excited to return and enjoy a meal in the North End. The experience is a little different now due to the increased outdoor seating on the already crowded streets, but generally the good food and old-fashioned italian vibes are still there. I enjoyed my meal at Cantina Italiana aside from a few small hiccups, including a large party of loud birthday-celebrators (which was not the restaurant's fault but stricter limitations on group size/noise level would be appreciated). In general I was a little surprised at how close together the tables were inside the restaurant, given the current social distancing guidance.

Not every pasta dish on their menu contains pasta handmade on site (understandable given their size), so I specifically tried the Bombolotti Alla Buongustaia because it was described as their signature house-made pasta with handmade sausage. All the flavors together were SO tasty and that house-made bombolotti was in fact bomb. Definitely would get this again!

I also tried the Scialatelle with Salmon, also described on the menu as house-made. The pasta itself was good, but unfortunately the sauce was lackluster. It was salvaged by adding salt to bring out the mild flavor that was there, but really could have used some more robust seasoning."
12,Cantina Italiana,5 star rating,1/4/2022,"We had a great experience at dinner tonight with our server Omar! He was fun and very polite! We have came here several times and he always is very nice and personable with us, even when it is very busy! We would definitely come back here again. The food is amazing as well as the service!"
13,Cantina Italiana,1 star rating,4/11/2021,"This is not the place to be if you're looking to get martinis. Started with a cosmopolitan that came out sweet and nothing like what it's supposed to taste like. Espresso martini was on the lighter side with almost no espresso just a lot of baileys. 
They need a better system put in place for hectic weekend nights. I watched our appetizers be brought to multiple tables before getting to us. 
The truffle fries & prosciutto and mozz were the only things I would recommend getting. 
As plates were being brought out, the cacio e Pepe looked yummy but actually was the opposite. Noodles were too hard and the plate was warm so the cheese was getting sticky. Little to no taste, would not recommend."
14,Cantina Italiana,5 star rating,10/24/2021,They made me a custom spaghetti and clam sauce a mix between red and white. It was so good better then I expected i would highly recommend it. my waiter Manny was excellent
15,Cantina Italiana,1 star rating,9/6/2021,"This review is about the very messed up person who takes reservations and seats you, we didn't even make it  inside the restaurant because of her aggression towards us. We didn't feel safe going in because she was physically aggressive. If you catch her on a bad day she might end up ruining your evening so bear that in mind while making a reservation at this place. There are multiple reviews calling her out and I've never been treated this horribly anywhere so am gonna take the good money I was about to drop here, to so many other incredible places in the area.

We went there on a super busy night were walking to the check in counter outside the restaurant on the pavement when I saw a crazy lady yelling at the long line of customers waiting patiently and adhering to social distancing. *she did not have a mask on and was yelling so much her  spittle was flying at people*. She was unraveling and clearly needed to be sat down and taken care of or given a break to collect herself as she was abusing everyone at the restaurant and creating a huge scene outside ruining the experience of the people who had gotten in and were looking for a nice evening. 

We walked up to get to check in and instead of explaining the next steps and where to wait she started yelling at us without understanding that we were just looking to her guidance. I am still shaking and can't make sense of anything that happened. We just walked off after she started spitting at us because my family's health is paramount and no meal is worth contracting covid."
16,Cantina Italiana,3 star rating,9/25/2021,"We made a reservation for 8:15 but weren't seated until 9:00pm and weren't fed until 10:00pm. Pasta was good and portions were large, but the wait was too long! If there weren't a wait, it'd be a 4.5/5 instead.

PS - ambiance is homey but loud"
17,Cantina Italiana,1 star rating,3/20/2022,"So far the worst place we have been to in the North End. We had a reservation, but there was no table for us (~30min wait outside). The worst, however, was the food: the least authentic pasta carbonara with cream (why?!) and almost no bacon for the amount of pasta, and the cacio e peppe was basically just plain pasta with a few ungrounded pepper corns. But that was not all. The wine (Barbera) was undrinkable and the prosecco was completely flat like a white wine. How on Earth can this place survive?! There are so many gems out there in the North End (Carmelina's, Giacomo's, Neptune, ...), just don't waste your time or money here..."
18,Cantina Italiana,5 star rating,12/27/2021,We dined at Cantina Italianna on Christmas Day. I ordered Saltimbiccq Chicken - pan seared chicken and sautéed with foraged mushrooms in a marsala wine sauce topped with Prosciutto di Parma and mozzarella. The dish was great. Bigger portion compared to those served in New York.
19,Cantina Italiana,1 star rating,11/27/2021,"We had a reservation, they told us that reservations are first come first serve. Sorry what is the point of a reservation? This place is a fucking scam why do you have reservations if they're not reserved for people who actually made them. Host staff is just as useless and unaccomdating. We were one minute late after getting a text that said our table was ready and by the time we got there they already gave our table away. Their  host was laughing at us. I hope you all choke on your meatballs."
20,Cantina Italiana,1 star rating,11/27/2021,I would give them 0 stars if I could. We had a reservation at 7:30 and we got to the hostess stand and the hostess said our reservations don't necessarily mean that you will be seated at that time and that we would have to show up within ten minutes once we were notified that our table was ready... we waited patiently for the table and were texted that our table was ready and when we walked over within 30 seconds... they gave away our table. This restaurant has the most unprofessional hostess who also chose to laugh at the situation when we were waiting in below freezing temperatures for over 30 minutes.
21,Cantina Italiana,1 star rating,6/17/2021,"I literally have never been as disappointed as this meal.   The location was recommended by locals, and even our hotel.  
Each sauce tasted the exact same (alla vodka / spaghetti sauce) and the noddles were over cooked and mushy.  
We hoped for fresh hot bread at the table, and that was not the case.  
It was the ONLY meal during our five days in Boston that we regretted.  It still upsets me that we spent $145 for a family of four on what we hoped would have been our favorite meal."
22,Cantina Italiana,5 star rating,7/12/2021,"This was amazing restaurant as the meal was full of flavor, and cooked perfectly. The device was attentive and joyful. Highly recommend this great place. Also not overpriced, worth every penny!"
23,Cantina Italiana,4 star rating,7/6/2021,"We thoroughly enjoyed our dining experience here! Was it the best Italian food I've ever had? No, but it was incredibly delicious and everyone was happy. We had the mozzarella and prosciutto appetizer, lasagna, fettuccine carbonara, vodka sauce and spaghetti in my group. Generous portion sizes! The service was excellent too. They were out of bread but then told us they called local bakeries to see what they could find for us. It just showed they cared. Some of the outdoor tables were slanted and I saw two different cocktail glasses slide off the table and shatter."
24,Cantina Italiana,5 star rating,9/18/2021,We got there not too long after they opened so there was no wait. All of the staff was very friendly and attentive. Our waitress was funny and enjoyable. The food was delicious and did not take long to get.
25,Cantina Italiana,5 star rating,10/9/2021,"Oh my goodness! My husband and I came up from DC to visit family in Boston this weekend. My brother-in-law from NY made the trip with us. The ultimate goal - find the best Italian food in the north end. We succeeded. Cantina Italiana was, quite literally, the best I've ever had. And we have to give the goddess who makes this place run so beautifully SO MUCH love. Maria Delvecchio is an absolute queen. She made our visit so incredibly special. We love you, Maria. We'll see again you soon, Cantina Italiana!"
26,Cantina Italiana,5 star rating,11/14/2021,"We made a last minute restaurant switch and did not regret it! Loved the vibes, the classic Italian feel, the service was great and the gnocchi made me FEEL THINGS."
27,Cantina Italiana,5 star rating,9/25/2021,"First time having risotto and I loved it. The mussels were great, they gave me plenty of mussels. The staff was friendly and they were kid friendly as well."
28,Cantina Italiana,1 star rating,10/10/2021,"WORST DINING EXPERIENCE EVER!!!!

This is only my second review, so bear with me...  No reservations and while second in  line, we witnessed a bitter, old hostess/owner berating a server and then complaining about her to the first in line customers.  We were told 10-15 minutes for a table.  After 30 minutes of people watching (the location IS great) and hearing the hostess saying there was no wait, I asked and we were immediately seated. My first WETF.  The berating continued...  Imagine eating at a ""quaint Italian restaurant and hearing yelling from the hostess, ""YOU GOTTA KEEP THE AC ON!  YOU GOTTA KEEP THE AIR FLOWING!  Or ""WE GOT A PARTY OF 13 COMING IN!  DO THIS AND THIS AND THAT!""  My second WTF.

I was embarrassed for myself.  Why didn't I speak up?  ""STOP OPENLY CRITISIZING YOUR STAFF TO YOUR CUSTOMERS!  WE ARE ATTEMPTING TO ENJOY A NIGHT OUT!  And/or ""COULD YOU KEEP IT DOWN WHILE WE ARE ATTEMPTING TO ENJOY A MEAL OUT?"" 

The food?  Poor at best.  Maybe it was what we ordered.  The $35 veal was dry and tasteless, the pasta was overcooked and miniscule (isn't pasta cheap?) and the sauce tasted burnt.  My ultimate WFT.

Other than our server, EVERYTHING SUCKED!!!"
29,Cantina Italiana,5 star rating,7/5/2021,"What a treat. Yummy food, generous portions, attentive service, options for eating inside or out. What's not to love?"
30,Cantina Italiana,5 star rating,11/3/2021,My wife and I got lucky when we chose this restaurant! This is a true North End gem. The restaurant is very authentic and the food and wine were excellent. If you are ever in Boston make sure that you go there for a nice dinner!
31,Cantina Italiana,4 star rating,9/19/2021,"Service was delayed but food was solid! Waited 30mjn past our reservation to be seated and 35 minutes after ordering for food (nothing too crazy on a Saturday night). Mariana our server was friendly. Hostess definitely was not, but she was able to manage the large amount of folks waiting for their tables so it was effective. For the price and atmosphere, maybe I'd try somewhere else when I return to the North End, but being able to make a reservation was a plus."
32,Cantina Italiana,5 star rating,12/8/2019,"The North End is filled with its hits and misses, sprinkled in between the classics like Mike's Pastry and Vittoria Cafe, but Cantina is a total home run in my carb-loving book of Best Italian Eats. I came here for my birthday dinner and it's like being transported to old Italy -- you walk into the sounds of Italian being spoken, smell the comforting zing of tomato sauce, and imagine someone's nonna cooking up a homemade pasta dish for you. There's a certain charm to the whole place that I haven't really found replicated in any other restaurant in Little Italy. 

Maybe it's the booths -- being seated in one puts you in a little world of your own, where despite it being super busy / a packed house, you feel like you can have an intimate conversation with your table, and savor over all the dishes you ordered together, sharing pieces of your dish with your friends and family, just like you'd imagine a homey Italian dinner.

We were on a time crunch with tickets to a show, but somehow our (amazingly efficient / sweet) waiter was able to work with the kitchen to get our dishes out quickly and impeccably cooked. 

I had the Bombolotti alla Buongustaia (Bombolotti pasta, spicy Italian sausage, fresh basil, marinara sauce, parmigiano), while we shared a few apps I can barely recall since we devoured them so quickly. I had never had bombolotti, but this was hands down my favorite of everything we ordered. The pasta was cooked SO perfectly, and that sauce! Suffice to say, I'll never train for a sprint or a marathon, but I can proudly say I can devour a multi-course Italian meal in under 45 minutes. Which should be record-holding, in some country, I'm sure. 

It's generally impossible to get my niece to a) eat her dinner or b) talk to any strangers, and she literally left hi-fiving the waiter and saying how amazing the spaghetti was, so home run it is:)."
33,Cantina Italiana,1 star rating,9/26/2021,It won't let me leave a 1/2 star but these people SUCK SUCK SUCK Had us wait 40 minutes for a table then after an hour of waiting for our food they came to us to say they lost the ticket and no one made our food. AND they wouldn't rush it so it would be another 30-40 minutes and suggested we go eat somewhere else!! I literally hate you people.
34,Cantina Italiana,2 star rating,8/29/2021,"Not a great experience. For starters, none of the waitstaff nor the hostess were wearing masks. They didn't even acknowledge it when we all had ours on. The Covid test positivity rate is 6.4% in the North End right now...
Beyond our fears that we were contracting Covid, we were disappointed in the service and the food. The drinks came quickly enough, but we waited a full hour for our food. The pasta fagioli soup had nearly any flavor. We never got the parm cheese we requested. The spaghetti and meatballs were very average and the spaghetti was slightly hard. The worst part, however, was the gnocchi. It was undercooked and the insides were powdery and dry. We were definitely disappointed overall, and the bill was huge and felt entirely not worth the $. Sad because it was our last big night out in the North End and we wished we had gone back to Monica! Next time..."
35,Cantina Italiana,5 star rating,11/25/2021,I haven't been there since I left Massachusetts the food it was delicious the service was fantastic the place brought back so many memories.
