,Name,Rating,Date,Review
78,Causeway Restaurant & Bar,2 star rating,12/14/2014,"I vacillated between 2 and 3 stars for this place.  It's more like 2.5 stars.  I believe this is a newer place, right across the street from the Garden.  I came here after an early afternoon celtics game with my dad.  

Red flag #1 was the fact that this place was empty and people were bypassing it for a more crowded Harp.  That was a harbinger of things to come.  

First impressions was this place was a BBQ joint, though the menu had some odd items on it.  I went with the Cubano, which was average at best.  The problem was the sides.  Cranberry mashed potatoes?  Really strange tasting.  The baked beans were a disgrace to any BBQ place.  Watery and definitely undercooked.  My dad seemed to enjoy his chicken salad sandwich and clam chowder (with cornbread and olive oil.  Wtf?).  I'm not sure what the chef is really thinking with some of these combinations.

To make it worse, our server was slow despite having literally no one else to serve.  She even forgot what my dad ordered.  Twice.  

I probably will avoid this place in the future for food after a game."
79,Causeway Restaurant & Bar,5 star rating,9/16/2015,"Food was Superb  make sure you take advantage of the newly added ""Fried Mac n Cheese balls"" for an appetizer and the ""Chicken Quesadilla"" which was fresh well seasoned and crispy. Great job Chef Jeshua 

The service was 100% on point! The bartender poured and had ready a glass of water with a lemon on side and placed in front of me within a minute of sitting at the bar and proceeded to be very attentive and hospitable. Make sure to ask for Dave and say ""HI"" he is the man!

The overall atmosphere was great from the friendly staff, music and decoration/setup definitely a place you need to experience! 

Thank you Tim for a great time!"
80,Causeway Restaurant & Bar,1 star rating,11/4/2017,I would give no star if I could. Waited half an hour in line to get into Causeway and waited another hour to get upstairs to the club? Saw groups of people skip the line and get into the elevator to go up to the same club. Won't be back.
81,Causeway Restaurant & Bar,5 star rating,2/2/2015,"This review is long overdue.. I went to the Causeway when I was home just before Christmas.  The service was excellent, as were the wings.  It is extremely hard to find a restaurant in Boston that actually knows how to make Barbecue, and this place has NAILED IT!!

I went there with a fairly big party and we got plenty of items off of the menu.  Wings were unreal, wing tips were also a great appetizer.

I then got the brisket which was extremely tender and cooked just as if I was eating it down in the south at a BBQ joint.

I ended up staying there pretty late into the night and the place filled up with a great crowd of people.  Bartenders were very cool and mixed up some great drinks.  

Overall, I will def be back to this place the next time I am in Boston."
82,Causeway Restaurant & Bar,4 star rating,10/1/2017,"We checked out this bar/club after a concert at TD Garden. The wait was not too bad (~10 minutes) to get inside and a $10 cover. We had quick service at the bar and then proceeded to wait in another line for the upstairs ""club"" scene. Once inside, the music was really good- great mix of popular hits and throwbacks. The only down side was the lack of mats to prevent the floors and stairs from being so slippery from spilt drinks."
83,Causeway Restaurant & Bar,1 star rating,7/17/2017,"I was very disappointed with the Causeway. I went with a group of friends on Friday night because the line was short to get in, and paid $10 for cover. We got inside and got drinks only to realize that the real line to get into the dance area was inside, after you already paid cover. Sleazy move. Waited 50 MINUTES in line inside and still were not in the dance area. We asked for a refund on our cover charge since we just waited in line for an hour and were thenkicked out of the bar aggressively and swore at by the manager. Will never return and will tell everyone I know that this place is definitely not worth it especially given the other great options in the area."
84,Causeway Restaurant & Bar,5 star rating,3/14/2019,"Such a terrific spot in the heart of the sports world in downtown Boston! The service and friendly staff were only a part of our enjoyable evening. The food and bar service were excellent - they have a bacon cheeseburger w bbq sauce that is heaven!! Their apps are so yummy esp the truly exotic cheese plate, the shrimp, and the pub chips. Sam the bartender (shouldn't every bar in Boston have a Sam?) is great, with super suggestions for spirits suggestions. The chef came and visited with us which really topped off our night. Looking forward to our next visit FOR SURE!"
85,Causeway Restaurant & Bar,5 star rating,5/16/2018,"My husband and I stopped here to grab a quick meal before the celtics game. It seemed pretty busy when we walked in, but we were seated upstairs shortly. It was loud but what do you expect from a crowded restaurant. Our food came quickly and correct. Everything was so good and exactly what I wanted. We left feeling full and happy."
86,Causeway Restaurant & Bar,4 star rating,9/13/2015,"If you're going for drinks, especially beer, you're at the right place. They have a great list of beers on draft and have security which is a plus. The staff is really friendly and they serve you pretty fast. 

The kitchen closes at 10 on Sundays, which was a bummer. My friend had to order for me while I was on my way. 

It's not in the prettiest area but it works overall. Try not to walk over there at night if you're more than 10 minutes away. Not very safe. (Man or woman) 

This place is a nice and organized bar. I wouldn't consider it a restaurant per se although I must say that the food is great and affordable. Had a burrito on a plate and my friend had a pulled pork sandwich with beans and cole slaw. His portion was abundant."
87,Causeway Restaurant & Bar,4 star rating,1/19/2015,"Great barbecue! They have a legit smoker and you can tell. We have never had a bad meal here and they have a variety if beer. Its a hidden gem before any game at the garden. 

The quesadilla's are my favorite and the corn bread is spot on. The food is served quickly but with enough time to enjoy yourself. Baked beans were spot on, and the Cesar salad was vert different. They even give you complimentary home made bbq sauces in glass bottles. Nice touch. I highly suggest this new spot!"
88,Causeway Restaurant & Bar,4 star rating,8/17/2017,"We came here for a Riddim+Blues event. It was an R&B brunch. They played mostly 90's r&b (my all time favorite genre) and my wife and I both had chicken and waffles. Pretty good food, definitely tried to skimp on the syrup though but when we asked there was more. I had a drink called Bonita applebaum. OMG so good. Rumchata, some kind of apple liquor and caramel. If I was driving I would have had 648e76287464783 of those."
89,Causeway Restaurant & Bar,2 star rating,4/27/2019,"This bar has great bartenders and DJs, but the bouncers/security let any drunk person, who is falling on the floor, stay in the bar. There is unreliable security and the upstairs floor feels like it is going to fall in when people are dancing. Also, definitely don't wear nice shoes to this bar!!!"
0,Zume's Coffee House,4 star rating,12/6/2020,"LOVED their coffee but honestly thought there wasn't enough care put into the bagel. During my review (full video below) I said the taste was there but it was soft and not warm enough. Turns out their bagels are from Iggy's which I know has good bagels.

"
1,Zume's Coffee House,2 star rating,3/25/2022,"Of the clutch of coffee shops and cafes in Charlestown MA, incredibly, just this one - Zume's - no longer allows customers to use their bathroom, even in an emergency and after paying for items.  

So if you order at Zume's and gotta go, no luck ""because it's Covid""!? This is the end of March 2022 when Zume's management no longer requires masks. But they keep the bathroom locked behind a hanging curtain?! 

So best advice is go forth to Tatte, Starbuck's, Sorelle's, Style, and other local coffee shops that respect customers enough to maintain an accessible, clean restroom post-Covid."
2,Zume's Coffee House,5 star rating,7/10/2021,"My morning tradition. Good coffee, pastries, and people. Love the recent remodel and looking forward to spending some time in the window seats watching Charlestown walk by."
3,Zume's Coffee House,1 star rating,2/19/2020,"So I have been living in Charlestown since September, but today was my first time to Zume's. I normally make my coffee at home but I'm out of almond milk and thought I'd stop here on my way to work. 

I brought in my Yeti cup figuring that maybe they offer a lower price for bringing your own cup (come one people, let's save Earth one cup at a time). Nope I was in fact charged for a large when I'm sure my 20 oz Yeti is most likely smaller than their large. No almond milk on the counter and I was in a rush so I didn't want to wait back in line to ask for some. Oh well. ""Large"" drip coffee medium roast and yogurt parfait for a whopping $7.38

This is not what bothered me about this visit. I get to work, have a couple morning meetings and finally sit down at my desk to enjoy my parfait. I open it up to find black hairs in the parfait. I would normally be ok and just say let's pull that hair out and carry on, but the more I dig around the more hairs I found. Absolutely foul. This is unforgivable in my mind. I would hope the employees making these parfaits would be wearing a hair net, but clearly not. 

I would love for a manager to reach out to me to resolve this matter. This is appalling for any food industry service. Yuck."
4,Zume's Coffee House,4 star rating,4/30/2021,Cute place. Baked goods were yummy and the honey bee latte hit the spot on a chilly day.
5,Zume's Coffee House,5 star rating,4/24/2021,Great local spot with super friendly staff! My daily destination. Great variety of breakfast and lunch treats.
6,Zume's Coffee House,4 star rating,6/20/2019,"COFFEE.
real COFFEE.
COFFEE with testicular fortitude even.
Tasted like coffee, not a warm brown undistinguished beverage.
Take a BOW, Zume's.

We dropped in just before closing time after a big walk / climb and exploring Bunker Hill Monument and museum in Charleston Ma.

Service issues alleged by other reviewers were a non event in our experience. Greeted warmly. Served promptly. WiFi worked, no passwords = no problemo.

Savoury quiche was passable nothing special.
Passing grade (barely) in the cleanliness department,
Soundtrack not in my sweet spot, a tad whiny, but hey......

A comfortable oasis on a day when our 1st choice in Charleston for lunch stopped serving at 3 pm and we didn't fancy 'bar snacks'.... and we kept walking.... 

was ZUME'S.

Mom n pop shop NOT a mean big green logo originating in Seattle = a plus.

Solid 4 star coffee house.
recommended.

pics to follow"
7,Zume's Coffee House,3 star rating,11/27/2020,"The breakfast sandwich on the English muffin is great. The service is terrible. The owner, I assume, has been snippy with me every time I've ever been in the shop. I've lived in Charlestown for seven years, and literally only bother going to this shop when I want an excellent sandwich with a side of straight up rude."
8,Zume's Coffee House,5 star rating,10/9/2020,Love that they have oat milk! Makes it an easy yes when suggested. My only suggestion for them would be to have more vegan options. A vegan cookie would have gone great with my London fog!
9,Zume's Coffee House,5 star rating,5/29/2020,"Great coffee (strong but not harsh) and yummy baked goods. I mean, look at this guy! Super nice people. Will definitely keep visiting."
10,Zume's Coffee House,5 star rating,6/5/2021,I love Zume's. The staff is friendly and the coffee and baked goods are just plain delicious. This is the perfect neighborhood coffee house and one of my favorite parts of living in Charlestown.
11,Zume's Coffee House,1 star rating,8/18/2019,"Honestly though,
I'm all for supporting local. I walked by this place alot and it was always closed. I finally was around when open so i gave it a try. Man did I soon regret that.  looked at the menu for a bit, then once decided was still ignored,for a few mins. They finally notice me and I order. Got a hot salted caramel latte, even tho I ordered oded. Didn't say anything because i figured maybe I didbt say iced eveb tho I'm almost positive i did. Then I get the cup, its barely halfway full, AND its like salt water. So NASTY. Honestly, ill just stick to the Starbucks 2 more minutes down the road."
12,Zume's Coffee House,5 star rating,9/5/2020,"The best coffee and community in Boston!

So stoked they have added vegan options to the menu. 

The chickpea wrap is amazing!! A must visit when in Charlestown, great location right on Main Street."
13,Zume's Coffee House,5 star rating,5/1/2019,Zume's had a friendly atmosphere and a lot of choices for breakfast. I got the egg and cheese sandwich on an English muffin (the best English muffin I've had in a long time).
14,Zume's Coffee House,3 star rating,11/1/2019,"Left and went to Starbucks. No power outlets, WiFi was terrible in that it kicked you off every 15 minutes. Friendly staff, ok coffee, not a place to hang out. I was going to stay for a while and get more to Eat and drink, but I had to leave because I needed a power outlet. Starbucks it is."
15,Zume's Coffee House,5 star rating,6/12/2019,"Delicious english muffins and breakfast sandwiches! Cute place to sit and get work done, lots of fun artwork and interesting people."
16,Zume's Coffee House,5 star rating,5/31/2016,"Dude, yes!
The food was good. Got the sausage breakfast sandwich on a croissant.
The coffee was good too. Gotta iced mocha with an extra shot.
The red chairs were sooooo cozy.
The vibe was super chill.
Coming again during my visit here."
17,Zume's Coffee House,5 star rating,10/23/2019,"Went here for the first time this morning - I might be a regular customer from now on! Very friendly service, a great tasting americano (not acidic at all) and a very fluffy glazed donut. All in all a great experience."
18,Zume's Coffee House,2 star rating,1/15/2019,"I have been coming to Zumes for years as I love to support local businesses, but after a few recent visits that were below average I will now be finding a new coffee shop. Their iced coffee is one of my favorites, but that does not outweigh the poor (and often rude) service that I have received during my recent visits. There are not many things that can turn me off of a place I once loved, but rude service is just not appreciated, nor is it appropriate."
19,Zume's Coffee House,5 star rating,10/23/2017,"I sat here for about an hour or so to do some work, and I also ordered an iced chai tea latte, which was good, but this review is mostly about the service! I forgot my wallet, and didn't realize until about an hour later, after Zume's had closed! However, one of the baristas answered immediately, and when I mentioned the wallet, she said she'd put it in their safe after checking to see if there was any contact info inside. They were still closing, so she said I could come by and get it if I could be there in the next few minutes. Overall, she went above and beyond to help me, and I'm super grateful!"
20,Zume's Coffee House,4 star rating,5/1/2018,"Zumes has been a Charlestown staple for some time now.  The coffee and food appeals to a wide selection of tastes.

I love the display of local art (which is updated regularly).

The service at Zumes is friendly, well organized and efficient.

There is always a hustle and bustle adding to the friendly vibe.

I personally prefer supporting local business owners."
21,Zume's Coffee House,4 star rating,5/23/2018,"When Zume's first reopened, I was not impressed. But 5 years later (and 1 ""no strollers inside"" policy) my opinion of this place has really changed. I've seen a conscious effort from management over the last few years to be more welcoming and hire more friendly staff. They've also rolled out several new food options including a larger variety of pastries and quick to-go lunch options like burritos and sandwiches. 

I think this place has finally become what Charlestown needed - a great little neighborhood coffee shop for the locals. Here's hoping that people continue to come here and support Zume's in spite of the new Starbucks down the block."
22,Zume's Coffee House,4 star rating,9/13/2015,"Love that this shop is so near my home, though that has no bearing on my review.

The interior is a cozy mix of industrial coffee house - sort of an ideal presentation in 2015. That interior alone is nothing to write home about, though the original wall art is always a welcome display. (I just wish I could afford some of it!)

The stars of this place is the food and coffee - just what you'd hope for at a ""coffee"" shop.

I got an Americano and added a touch of cream and sugar. (I prefer it con panna, but I realize not all coffee shops have whipped cream. No worries, it was still a great tasting espresso.)

Baked goods are always hit or miss to me. Sometimes they taste old, and you're sad you even gave them a shot. Not these! The quiche are made, then frozen, then thawed for display - still relatively fresh. My bacon and swiss quiche could have easily been fresh. After heating, the crust was a bit dry and softened under the reheating, but the lovely inside bits made it all come together nicely. It's so easy to ruin a quiche when runny eggs or too much of any one ingredient. These tiny pockets were harmoniously made.

Then I got the key lime tart. My hopes of saving it for later were a failure. That flamed marshmallow topper and golden graham crust were too luscious to ignore after my quiche. My remaining espresso needed a partner with whom to go down gracefully. Wow! Crusts on deserts are my favorite part. Faintly buttery, crispy but soft, and just a little sweet. The filling was everything you'd hope for from a quality pasty - not the lime green stuff you find in a sad, pre-packaged box. The marshmallow topping hid that glorious secret (normal colored filling!) all-too-well. Sorry, tart, I just couldn't save it for later. 

Which is ok, since I hope to be a regular at this place.

And, lest I forget, the staff were friendly and helpful. Nice crew."
23,Zume's Coffee House,4 star rating,2/28/2019,"Great little coffee shop with friendly service and good snacks. Coffee is full of great flavor, molasses cookies are incredible and the service is friendly. They have good little seating areas with local art on the wall. Nice place to spend some time."
24,Zume's Coffee House,2 star rating,1/13/2019,Coffee is okay. Sometimes it tastes burnt. Ordered a breakfast sandwiches that was really tough to eat. The bagel was definitely not fresh.
25,Zume's Coffee House,5 star rating,5/27/2019,"Been living in Charlestown for 30+ years and this place is legit. If you have kids, it's perfect. The nitro coffee is amazing and all the food is delicious. All the ""poor service"" reviews are BS. Support local business!  Can't miss."
26,Zume's Coffee House,5 star rating,4/25/2019,"You'd be hard-pressed to find a better breakfast sandwich with an english muffin. I got the sausage egg and cheese and it was a total knockout. It's essentially a Portuguese EM, fluffy and moist. Incredible."
27,Zume's Coffee House,5 star rating,4/23/2018,"The 5 stars is for their version of an English Muffin . More often than not I have to use a condiment on breakfast sandwiches due to the bread being so dry . I have now gotten the sausage breakfast sandwich three days in a row and each day it has been consistent . I'm a simple coffee girl . I just like black iced and they provide that at a decent price and not tasting burnt . I just moved in around the corner so I will pick this over Starbucks , only minus is it's very limited seating and it's usually full"
28,Zume's Coffee House,2 star rating,8/29/2018,"I really want to like this place but I can't. 

On multiple occasions I have been treated rudely by staff. The least of which has been eye rolls when ordering as I am not completely familiar with the menu. The worst is when I asked for a ""regular"" coffee as many small coffee shops have a regular and large size and getting rudely asked ""well, what is a regular?"" The staff here could save a lot of time and energy if they weren't so rude. 

Another problem I have is their hours. If they were open later I'm sure they would have more customers. I would rather support a local business like Zume's but if they make it difficult for me I can just use my drip coffee machine at home."
29,Zume's Coffee House,5 star rating,11/8/2018,"My girlfriend and I were staying in Charlestown and this cool little place was right down the street.  The staff is great! We had some cool conversation waiting for my coffees.  The Incredible Hulk singing ""Thriller"" on Halloween made my day!"
30,Zume's Coffee House,2 star rating,6/25/2018,"I really can't wait until cafe Nero comes to Charlestown and runs this place out of town! I have been there 3 times since it is right down the street from where I live and the 3rd trip will be my last.  So, the first time I went to Zume's I wanted a cold brew which they did not have, even though every coffee shop in the city including Dunkin Donuts now has cold brew. The second time I slept in on a weekend day and was craving a breakfast sandwich- well this is the only coffee shop I've ever heard of that does not serve breakfast past a certain time( like after 10:30 or 11am). I decided to go back because i was excited to hear that They finally served cold brew. So I went in and ordered a medium- $6.26.  I honestly thought she was kidding. Needless to say, I will not be back . It's too bad because it is a great space in a great location!"
31,Zume's Coffee House,5 star rating,12/19/2019,I wanted to try this place for a while and it didnt disappoint! The coffee was delicious and fresh. I got a breakfast sandwich and it was great. I highly recommend Zume's!
32,Zume's Coffee House,3 star rating,5/8/2018,"Just Okay

We wanted a cup of coffee and a few minutes to relax, so we popped in here.  While there was certainly wrong with anything (except the wi-fi), there was also certainly nothing memorable the place.  The service was adequate, the coffee was decent, the seating was comfortable, and the wi-fi didn't work."
33,Zume's Coffee House,3 star rating,5/10/2018,Stop by today for lunch. Clean quiet atmosphere in this coffee house. Staff was very helpful and ready to take my order. I purchased a lemonade and black iced tea. It was awesome! The cranberry and chicken salad was also awesome except for the small bone that pierced my tongue.
34,Zume's Coffee House,5 star rating,8/8/2016,"Good coffee and the pastries are amazing really tasty and fresh not super sweet I think they have the right amount of everything, the staff is always nice and patient if you are trying to decide what to order, the vibe in the place is chill and it welcomes you to stay and relax I recommend it if you are around !"
35,Zume's Coffee House,2 star rating,12/9/2017,"Poor service 
Had to argue to get a simple drink the way I like it 
Not even a simple thank you 
Rude in a word 
Coffee marginal at best 
Atmosphere okay and comfortable"
36,Zume's Coffee House,5 star rating,8/22/2018,"Comfortable chair, great coffee and breakfast sandwiches and pastry.  Relaxing and laid back. Friendly staff."
37,Zume's Coffee House,5 star rating,5/23/2016,"Zume's is the best.  Coffee is consistent and good.  Customer service is great.  I highly recommend their baked goods and menu items.  I enjoy the egg and cheese bagel- without cheese, add ham and extra egg.  It's under $5, what a deal.

The chocolate chip cookie is like crack.  Sometimes I wish I had never tried a chocolate chip cookie from Zume's.  But I did, and now when I want to treat myself I get them.  They are huge, about 3-4 times the size of a normal cookie.  I like to enjoy 2 at a time.  Soft chewy center, large chunks of chocolate, and they are huge."
38,Zume's Coffee House,4 star rating,4/25/2014,"This is just what Charlestown was lacking; a laid back place to sip your latte and read or chat with some friends. Aside from the delicious coffee, this place is aesthetically pleasing with it's modern industrial feel. The artwork adds character and shows the connection to the community.

As an animal lover, it is great to see everyone gather with their pups outside, as Zume's shows their 4 legged friend support! All and all,  I am a lover of independent coffee shops and this place does meet everything I like in them. 

The only thing I wish is that they were open later at night. But being in Charlestown, the foot traffic may not be worth the extended hours! 

Keep it up guys!"
39,Zume's Coffee House,4 star rating,6/9/2015,"This is a cool little neighborhood place, where the look, right down to the pastry cases, definitely is equipped like McBucks, but that is where the comparison stops. They have fantastic baked goods, and a sizeable hot breakfast and sandwich array that comes out of a kitchen, not a Star-Trek-Meets-Suzy Homemaker convection warmer.  The coffee?  Very very good.  The only reason I drop it a star is because they have a ton of people working there, but when the coffee bar is slammed, and it's slammed, management only has one barista on? The place is packed as it's one of the few good breakfasteries around, so tell Scrooge McDuck to come up with a touch more cash for another pair of hands on the bar, please."
