,Name,Rating,Date,Review
0,Kipos Pizzeria & Restaurant,5 star rating,5/14/2016,"I feel obligated to give Kipos 5 stars because there is no way on Earth (or any other planet for that matter) that it deserves an overall rating under 4 stars. 

After reading all the reviews for Kipos, I was very apprehensive to check it out. 1.5 stars, really? It can't be that bad. If it wasn't for my close proximity, I probably would've just skipped it, but I'm so glad I didn't. 

First off, when I walked in the door, the sweet older gentleman and his presumptive wife were in there, MAKING THE DOUGH FROM SCRATCH! THIS IS NOT A TYPO! This alone should warrant a couple stars! You don't find your local Dominos putting in this kind of effort. 

They have a pretty extensive menu, but being primarily a pizza joint, I decided to try a calzone. I got the chicken parm calzone and let's just say this thing was a monster. For 11 bucks, you get a monster calzone that barely fit in the box! 

Once I sprinted home to sink my mitts and fangs into this monstrosity I had to cut it in half because it was so darn big. This allowed me to get a cross sectional view of all the delicious insides of this beast. It was loaded down with cheese and sauce and chicken, and I mean loaded down. Everything tasted so hot and fresh, I feel like what I got was in a different universe from that I was expecting after reading the previous reviews. 

There's no doubt I'll be going back, and now not just out of sheer convenience but because Kipos is awesome! A local place like Kipos that has been around in Charlestown for a while is right in my wheelhouse for places I love. Support local!"
1,Kipos Pizzeria & Restaurant,5 star rating,11/5/2020,"Pizza is not great honestly but the guy serving the pizza was the man! Tight knit neighborhood spot you can tell, wish I could've tried more food."
2,Kipos Pizzeria & Restaurant,2 star rating,10/27/2018,Chicken fingers or tenders they are the  same thing and sorry to say they continue to disappoint. I liked the Fry's but it's been a while since I had them. I get a Coke or a frappe there once in a while. They seem to be nice people.
3,Kipos Pizzeria & Restaurant,1 star rating,11/23/2019,"It's been a long time since I have ordered hear but I recently ordered from here and they was rude so I said to myself just let it go. I just tried to order from here again and once again very rude... "" so what the hell do you want "" I will never order from here again and hope they shut down... my second time trying to order and having someone talk to you like that is completely uncalled for. I was never rude just trying to find out if it was a small or large pizza we wanted and the guy who answered was very rude and so was the lady the last time I ordered. NEVER AGAIN!!!"
4,Kipos Pizzeria & Restaurant,5 star rating,11/17/2018,Best chicken fingers in town! No doubt. I moved into the area and have been trying to find a local eating establishment and now I've found it. Thanks Kipos!
5,Kipos Pizzeria & Restaurant,1 star rating,7/30/2015,"Not sure what kind of crime ring this shop is a front for, but it is clearly not related to food.

I had a hard time choking down the pizza that came out of a kitchen that was furnished by a hoarder in 1983."
6,Kipos Pizzeria & Restaurant,2 star rating,2/18/2018,"Tasteless pizza ... Legit. Subs are ok , calzones are like meat encased in a heavy brick of dough, cold cuts are good , the fries are probably the best thing they have , chicken fingers are gamey and rubbery tasting.  The clientele is mostly young kids which probably explains its surprising longevity in the area."
7,Kipos Pizzeria & Restaurant,1 star rating,7/28/2010,"Stop. Just stop right there. Who are you people? They USED to have bad pizza? 3 stars? 4 stars?!! Stop it!

Look, this isn't about pizza snobbery. I've had good pizza, and I've had mediocre pizza. But I love pizza in nearly every form. Those little frozen pizza bagels are fantastic to me! Even the greasiest late night bar crawl pizza is still tasty because it's pizza! People groan about Hi-Fi in Central Square, Cambridge. Sure it's not GREAT pizza... but it's still pizza and it's still tasty. Soggy, crispy, deep dish, thin crust, burnt, greasy, rubbery... I've endured it all and I've gone back for seconds. I love pizza. Who doesn't?

Kipos should not exist. This was, by far, the worst pizza I've ever had in my entire life... fresh... frozen... or otherwise. I couldn't even understand it. My brain simply could not fathom how a business could sell this and call it brick oven pizza. How can a business sell this and maintain a customer base? How are they making their money? Somebody has to explain this to me!

First of all, the establishment is a wreck. Ceiling fans hanging by wires, chairs and boxes piled up in the back like they're on their way to the dump, but they're not... they're covered in dust. It's as though this is some sort of sorrowful tribute to a bygone era. There's even an arcade machine sitting unplugged and covered in dust.

I ordered a large cheese pizza. The most simple of pies. They reached under the counter... shuffled a bit... and out came a pie, in mere seconds. It looked frozen, perhaps... I honestly can't say. But it was not made from anything fresh. My thoughts? Even frozen pizza is kind of ok... so I'll go with it.

I'm not the type of person to refuse to pay for an ordered meal... but man, in this case I wish I was. This pizza was awful. Thin little slices of  cardboard with crusty cheese on them. You could hold the slice vertically and nothing would move. You could throw it like a frisbee (I actually made the motion vigorously with a slice) and none of the ingredients moved. It wouldn't bend, flop, slide, or drip. This is NOT pizza. It reminded me of that scene in National Lampoon's Christmas Vacation when the turkey explodes... and they're all sitting around eating these little nuclear bits of crispy flesh.

Seriously guys... maybe it's run by a family of good people. But don't support this mess. They're not even trying. These good people need to move on and run something easier like an ice cream stand. They do sell ice cream here. Maybe that's where their bread and butter lies."
8,Kipos Pizzeria & Restaurant,1 star rating,7/28/2015,"This is a place you eat at if you are really hungry and there is nothing else around, I've had the steak and cheese, where's the cheese? My son had the pizza, didnt even want to finish it, they use the microwave for heating and cooking most of their food (no! ) they have to customer service skills to save their life. After i ordered for delivery once i said never again the lady knocked on my door and i told her more then once to hold on because i was in the bathroom and i know she could hear me (small house thin walls) she had someone bang on my window to get me to rush and come to the door"
9,Kipos Pizzeria & Restaurant,5 star rating,2/3/2017,I walked by this place and I decided to try it out. I ordered fries and a eggplant Parmesan sub and it was really good! I was surprised. The place could use a little fixing up but over all good place.
0,Caffé Vittoria,5 star rating,4/3/2022,"I don't reside in Boston, so my reviews tend to be of the places I love.  Caffe Vittoria is such a place.  A visit to Caffe Vittoria is a bit like stepping back in time to the 1930's.  It is also assuredly an opportunity to enjoy the best cappuccino in the USA.   

Service is not always consistent, so don't be in a rush.  It's ok to take your time and savor things."
1,Caffé Vittoria,5 star rating,1/12/2022,"Best. Cappuccino. Ever. 

I visited Boston from the SF Bay Area and really enjoyed the ambiance + coffee here. The powder on top elevated the drink a lot - subtle chocolate flavor lightly sweetened with the frothiness of the milk. 

Super yummy and would be such a great spot for a date or a drink with friends!"
2,Caffé Vittoria,3 star rating,12/16/2021,"I visit the cafe whenever I walk through the north end and it was a cute place! There were no issues being seated, but do expect indoors to be loud and crowded on weekend evenings. If you'd like a quieter experience, I recommend visiting earlier in the day. That being said, The BEST tiramisu in town. The espresso martini's are good, as well as the cappuccino.

Some things about the cafe:
-Have cash on hand
-it seems to be open pretty late, which is a plus factor.
-I'm not sure if it's because the building is old but there's an almost smoke like smell engrained into the building and walls. It reeks, almost like cigars, but there's no smoking allowed indoors so I'm not sure where it comes from. It's the biggest factor of why I don't like being in there too long. I eat my tiramisu and martini and leave asap.
-Due to the nature of the building being old, it seems they haven't renovated their bathrooms. There's holes in the walls in the bathrooms, which is creepy to say the least. 

Overall, they can preserve the buildings history while still making upgrades that would help out the cafe tons I'm sure. Still, good food and drinks and worth a stop when in the north end."
3,Caffé Vittoria,5 star rating,3/21/2022,So cute. Old school vibe with lots of locals. Friendly service -- all the espresso perfect for after a hearty Italian meal. almond milk cappuccino was perfect and the tiramisu was gone in 60 seconds. Perfect balance and not too sweet. I hear they have the best espresso martini :)
4,Caffé Vittoria,4 star rating,4/4/2022,Wish they had more options for non-coffee drinking customers. They only take cash only so be prepared for that.
5,Caffé Vittoria,4 star rating,3/13/2022,"Stopped in for a drink and to get out of the rain. Fun Italian vibe. Drinks were good but pricey, then again it is Boston and the North End. Service was great. Did not eat anything but the pastries looked good.  One day of my companions said it is the best espresso martini anywhere - could be fun to find out for yourself!"
6,Caffé Vittoria,5 star rating,11/28/2021,"A pretty cool ass cafe. Cafe Vittoria is a place to sip on some coffee or something more strong if you prefer a liquor. It has a pretty small menu of classy pastries and expensive things. Everything isn't extremely expensive though but it's more costly than a typical bakery. They also have desserts like sorbet. 

It doesn't have that much of a menu. Mostly it seems to be desserts and few things in the way of entrees and such. This is pretty much where to come after you've already eaten out and lie about being too full for dessert there. Coffee is a beverage of choice. There's also plenty of the classy hard stuff. I'm a Ladies Man so I get my Courvoisier. Please tell me you got the SNL reference there. It's $10 for a pour. They also have a Lemon Sorbet. It's $7 for a cup. This is fluffier than most sorbets. It has a light tartness that's not overwhelming or bitter. The only bad thing is it melts pretty fast so eat fast. 

A good place for classy desserts. It also has coffee and cognacs to sip on. The sorbet is the best palette cleanser so get it to finish up."
7,Caffé Vittoria,4 star rating,11/7/2021,"Stopped in for a cappuccino and walked out with a smile!

This CASH ONLY cafe knows how to do things right here. Their artistic creations brings happiness along with your drink.

This place is located on a very busy street so the crowd tends to shuffle in and spend some time enjoying the menu items."
8,Caffé Vittoria,4 star rating,12/5/2021,"Stopped by after dinner in the North End for some desserts and drinks on a Saturday night. This place was packed, but thankfully there are several floors so we were seated pretty quickly in the basement level.

Their menu is pretty expansive with a full bar and pretty much every coffee drink combination you could hope for. I got a mocha and flan for dessert. Upstairs vibe was loud, eclectic cafe x bar energy. Downstairs felt more like a pub with dark lighting, booths, woodsy interiors, and fewer people. Service was a bit slow, but to be expected due to the time.

Mocha was great and flan was rich and dense. Nice place to chat with friends and stay warm post dinner if you're not ready to head home yet. 

As a heads up, they were closing the basement level around 9:30pm on a Saturday and pretty much ushered us out (or we could have gone upstairs to wait for another table where it was really crowded). Something to keep in mind if you want to go chill here for a while. Also was cash only."
9,Caffé Vittoria,5 star rating,2/9/2022,"I absolutely love this cafe! This is a cash only place, and like most of North End establishments, it is pretty small so it can be a tight squeeze seating-wise. The inside is so cute, it's like being in an antique shop (in the best way!). Not to mention, their sweets are soo good. The tiramisu was perfection - not too sweet and had the right consistency. The limoncello mascarpone was on the sweeter side and also incredibly delicious."
10,Caffé Vittoria,5 star rating,3/15/2022,"BEST TIRAMISU EVER!! Come here after dinner for an amazing dessert. Its so light and fluffy, we had to order a second one it was so good."
11,Caffé Vittoria,4 star rating,11/12/2021,"Splendid.

Even though I do not drink coffee, I can tell their drinks are rich in flavor. They are also whimsical in appearance, fair in price, and vintage in name.

Whether you are going for an early morning pick me up, or that late night hopper, this is unparalleled value. Hard working ladies will ensure that you enjoy your hot beverage against the backdrop of 1940's and 1950's crooners swooning you with old favorites. It was a really special and unique experience that you can have too if you bring cash (sorry, no credit cards here folks). 

The best part was seeing customers recycle in and out. It seems people always want to be a part of something special here.

No wonder, because this cafe is something special."
12,Caffé Vittoria,5 star rating,4/6/2022,Best coffee in the North End.  They are cash only so just be aware of that when you go.
13,Caffé Vittoria,1 star rating,1/21/2022,"We stopped in to get out of the cold and grab some caffeine after an afternoon of shopping. Our small group had cappuccinos and sfogliatella. Service was a bit slow, but we understand it was very busy. Be aware that it is cash-only, tables are very close to each other, and the staff wear their masks under their chins (and do not respect personal boundaries, even after we asked nicely that they keep a little bit of distance). There is no excuse for being rude to customers and I'm sure there are other cafes with good cappuccinos in the area. (visited 11/7/15 and 12/31/21)"
14,Caffé Vittoria,5 star rating,9/6/2021,"By far my favorite cafe in North End! SUCH a cute shop with gorgeous interior design-- I love how they have old coffee machines/grinders and rustic framed posters. If you catch a spot by the window, you can get some natural sunlight and people watch. I came here 3 times during my one week Boston trip! 

Over three visit, I've tried their famous cappuccino, cannoli, tiramisu, iced latte, and americano. My favorite drink is the cappuccino and favorite dessert is the tiramisu by far. No complaints about the cappuccino-- the portion size was also quite large! Although the cannoli was very delicious already (especially dipped in the cappuccino!), their tiramisu is the best I've ever had. The flavor was so rich and I could really taste strong espresso in the soaked layers of cake. 

A perfect place to chill with a book, journal, or catch up with a friend, highly recommend!"
15,Caffé Vittoria,5 star rating,8/29/2021,"OMG! This has become my favorite haunt in North End. 

My friends and I all agreed that this place boasts the best tiramisu we've ever had. The first time we came, we split one slice and collectively finished it in about 30 seconds lol. My friend said he really liked the cannolis here too.

My favorite part of this shop is how their menu complements each other. I'd recommend pairing their pastries with a coffee drink with no sugar added, as the natural bitterness of espresso acts as a great palate cleanser in between bites of their sweet, creamy pastries. 

I was also a big fan of the venue, with seats next to their street-side windows. The natural sunlight here in the morning is great. 

Just be warned that this cafe, like most places in North End, is cash only, so come prepared! You definitely don't want to miss out."
16,Caffé Vittoria,5 star rating,12/18/2021,"Super cute place (very in the Christmas spirit when we went), very busy on a Saturday night, and they are CASH ONLY (but very fairly priced). We only tried the gelato which was delicious. I would love to go back and try their coffees and pastries as they also looked really good."
17,Caffé Vittoria,5 star rating,9/24/2021,"100% recommend!!! This was a highlight of our trip. To sit at a small Italian cafe (in the heart of little Italy) and be surrounded by individuals speaking the language helped us realize we were in for a treat. 

We ordered cappuccinos along with a slice of tiramisu. WOWOW... my mouth is watering thinking about it."
18,Caffé Vittoria,4 star rating,7/19/2021,"A quaint little spot to grab an Italian coffee and pastry. I especially loved seeing all of the espresso machines that the caffe has collected to display.

This caffe really reminded me of being back in Italy. You could walk into a bar, grab a quick coffee, say hello to friends, and then run off to continue your day. At Caffe Vittoria, much of the same was happening. Locals were stopping in to say hello and get their morning coffee. 

We stopped in hoping to enjoy breakfast pastries and a coffee. We have young children, and this isn't an ideal place to stop if you're worried about getting them something to eat also. The pastries are all rather dessert-like, except of course the biscotti. 

We ordered a cappuccino, americano, and a Napelatano. The pastry was yummy and very rich. The coffees were perfect. It's definitely a great place to stop for a coffee break and to have a seat and watch some of the world go by."
19,Caffé Vittoria,5 star rating,8/3/2021,"Located next to Mike's pastry. FYI do not eat your pastries from Mike's  if you order drinks etc. Not allowed. 

Nice service and we enjoyed our coffees."
20,Caffé Vittoria,5 star rating,3/21/2022,"I only wanted coffee! My daughter ordered the pastry for herself and it was so huge. As a mom, I had to help her. We're both so grateful. Wowza!"
21,Caffé Vittoria,5 star rating,7/6/2021,"This was a stop on a food tour and was the ""star of the show"" - cannoli in the opinion of the host was best in all of North End and after having one I could not disagree.  These are not mass produced like some of well known offerings on Hanover.  Not to say they aren't worthy of a stop but each city has those stops that are ""iconic"" but to locals you will find that better offerings are there for the taking (think cheesesteak in Philly, BBQ in Texas, Meixcan food in SoCal - there are well known spots and then the spots that the locals go to have that offering.  

Caffe Vittoria is that place for cannoli - the roll is crispy and not soggy due to pre-filled cheese.  The ricotta cheese is piped in AFTER shell is baked as it should be.  Best bite I had in Boston over the July 4th weekend.  Best sip you ask?  Oh why it was the cappucino here as well.  It was perfect temperature, silky and luscious with each sip.  I will definitely go back here next time around because of this cannoi and cappucino - it was that memorable - an easy 5 stars - don't even have to think about it - the mind doesn't come into it at all - just the taste."
22,Caffé Vittoria,5 star rating,7/17/2021,"My favorite place I visited while in Boston. This quaint, authentic cafe left nothing to be desired. We needed an afternoon pick me up, the cafe Vittoria delivered. We got iced lattes and a scoop of ice cream.

My favorite ice cream is Spumoni and only the authentic Italian places have the good stuff. I was delighted when I found out they offered it. It was so delicious and they drizzled a cherry sauce on top. The iced latte was just what we needed to continue our day - delicious, creamy and topped with coffee beans and chocolate shavings. 

Do yourself a favor and stop in here and enjoy one of the best places I've been to in a long time."
23,Caffé Vittoria,5 star rating,3/11/2022,"I will just say one word: TIRAMISU 
Now go, and enjoy. You are  welcome  Thank me later"
24,Caffé Vittoria,5 star rating,11/29/2021,"As much delicious food as there is to be had in the North End, coffee is a must for me.  Lavazza cappuccino with a delicious creama hit the spot!!  It was in the 30s and we'd been walking around for a little while.  This was my second visit - the place seems to be packed all the time.  It's crowded and loud.  I love every bit of it.  Our waitress was friendly, despite being very busy."
25,Caffé Vittoria,5 star rating,1/23/2022,"FYI: Cash Only! There is a sign outside, but somehow we missed it when walking in. We just stopped in for a Cafe Macchiato and Hot Chocolate and it was really delicious!"
26,Caffé Vittoria,4 star rating,11/8/2021,"Wonderful cafe in the North End. Solid gelato and coffee choices, as well as some alcoholic beverages. We tried the Caffe Mocha and it was wonderful. Service can be a little slow, but definitely worth the stop for an afternoon pick me up as a place to stop and rest before heading out again."
27,Caffé Vittoria,3 star rating,4/11/2021,"My friend and I came on a weekend morning for a sweet treat. The main room was full when we arrived, so we were seated in this back room with a perfect view of the trash barrels outside . I was surprised that the menu didn't have any prices, which made ordering pretty annoying.

We ordered an eclair and tiramisu to share. The eclair was nothing to write home about. It was cold, and the shell was kind of rubbery. The tiramisu, however, was absolutely delicious! It was actually the best tiramisu I've ever had! There wasn't an overwhelming amount of powder on top, and it was the perfect sweetness and texture! 

The service wasn't great though. The waitress barely came by. We wanted to order a second tiramisu, but literally an hour passed since she last checked on us. We literally had to ask for a check while she was finishing taking another table's order - or else who knows when she would come next. She also gave us the wrong receipt.

Overall, we loved the tiramisu and would've gladly gotten a second one. The poor service made the overall experience an okay-ish one. I doubt we'll be back to dine in - I'll try to grab a tiramisu for take out next time."
28,Caffé Vittoria,2 star rating,10/17/2021,"This was a definite miss for me. We had mediocre service, it was cash only, and my hazelnut latte was flavorless. 

It doesn't have a cute vibe or anything to make up for the downsides, so I'd look for another place for coffee instead."
29,Caffé Vittoria,1 star rating,10/9/2021,"Arrived on Saturday evening and instantly regretted it because this place was packed. We tried to find a table inside (failed) and then walked out disappointed. I find it curious none of the staff indoors let customers know that there are more seats in the other side of the cafe, which has its own separate entrance, counter, AND bathroom (you could easily mistake it for a restaurant next door). People often enter the side closer to the big white rectangular sign, see the tightly packed marble tables, and walk back out but I can assure you that right next to that entrance is another entrance that will lead to an entirely different lounge with bigger tables. 

I'm giving one star this time because after we failed to find a table for 4 indoors, we took a patio table. Someone came by to take our order while I had left to view the gelato flavors, but afterwards, no one came to take our order again. We tried to request a wait staff from the inside know that our table as well as all the other patio tables were ready to order. When I spoke with the counter staff to see if they could communicate someone to come outside, they stated they would be out but still no one came. We must've waited 20 minutes until we discovered the other lounge and sat at a table indoors yet again. Still no one came, even after it was obvious we had just sat at the back lounge. I spoke to 3 separate staff members to take our order, but it was not until I really took ahold of one by the counter, explaing that we had been waiting a while, that they finally sent someone over to our back table to take our order.  I most definitely understand the struggle of being shortstaffed during peak times and especially during the pandemic, but come on.... there was no apology. There was no ""Thank you for your patience."" Not acceptable. The gelato also came out half melted (not pictured), which was such a contrast to the gelato I was served when I first visited (see photos). This second visit left such a sour taste in my mouth that I don't think I'll be recommending this place to my friends and other locals again."
30,Caffé Vittoria,1 star rating,4/4/2022,"Horrible service.  Servers have an attitude, walked past us more than once to stand and take out their phones.  No smiles, which if you expect a tip you've got to earn it. Disappointing as I had heard so many good things about the espresso martinis.  Beverage itself was good, but didn't get positive vibes from the wait staff"
